id,Question,Informational,Guidance oriented,Institutional,Conversational,,
29,does npgc have study centers for distance learning?,"National Post Graduate College (NPGC) has a Distance Learning Centre that serves as a study centre for IGNOU (Indira Gandhi National Open University) and Uttar Pradesh Rajarshi Tandon Open University (UPRTOU). These centres provide certificate, diploma, and degree programs in distance mode, along with regular consultation classes and remedial sessions. NPGC does not offer its own distance learning or online programs independently; it functions solely as a support centre for IGNOU and UPRTOU students.","NPGC has a Distance Learning Centre that acts as a study centre for IGNOU and UPRTOU. If you are enrolled in distance programs through these universities, you can attend consultation classes, remedial sessions, and access support at NPGC. Please note that NPGC does not run its own distance learning or online programs—it only provides assistance to students of IGNOU and UPRTOU.","National Post Graduate College (NPGC) maintains a Distance Learning Centre functioning as a study centre for IGNOU (Indira Gandhi National Open University) and Uttar Pradesh Rajarshi Tandon Open University (UPRTOU). These centres facilitate certificate, diploma, and degree programs in distance mode and organize consultation classes and remedial sessions for enrolled students. NPGC does not independently offer distance learning degrees or online programs; it provides support services for distance learners affiliated with IGNOU and UPRTOU.","NPGC has a Distance Learning Centre where students of IGNOU and UPRTOU can get support. The centre runs certificate, diploma, and degree programs in distance mode and holds consultation classes and remedial sessions. Just so you know, NPGC doesn’t offer its own online or distance programs—it’s mainly a support hub for students from these open universities.",,
50, What are the office working hours?,College office hours are Monday to Saturday from 08:00 AM to 04:00 PM. The office remains closed on Sundays.,Students are advised to visit the college office between 08:00 AM and 04:00 PM from Monday to Saturday. The office is closed on Sundays.,"It is hereby notified that the college office operates from 08:00 AM to 04:00 PM, Monday through Saturday, and remains closed on Sundays.","The college office is open from 08:00 AM to 04:00 PM, Monday to Saturday, and stays closed on Sundays.",,
67,does college organise the farewell party?,"No, the college does not organise any parties for students.",The college does not host or organise parties for students.,The college does not arrange or conduct any parties for its students.,"Nope, the college doesn’t organise any student parties.",,
68,does college organise the fresher party?,"No, the college does not organise any parties for students.",The college does not host or organise parties for students.,The college does not arrange or conduct any parties for its students.,"Nope, the college doesn’t organise any student parties.",,
72,can I submit my research paper online?,"Research papers may be submitted online; however, students are advised to submit their papers in person to their research mentor or the Head of Department, as this allows for immediate feedback.","Although online submission of research papers is permitted, students are encouraged to submit their papers in person to their research mentor or the Head of Department. In-person submission enables students to receive instant feedback and clarification.","While online submission of research papers is allowed, students are advised to submit their research papers in person to the research mentor or the Head of Department in order to facilitate immediate feedback and guidance.","Yes, you can submit your research paper online—but it’s smarter to submit it in person to your mentor or the HOD. Instant feedback beats waiting in your inbox.",,
74,what are the different departments in the college?,"The college consists of 18 departments:

* Anthropology Department
* Economics Department
* Education Department
* English Department
* Geography Department
* Hindi Department
* Political Science Department
* Department of History
* Psychology Department
* Physical Education Department
* Botany Department
* Computer Science Department
* Physics & Electronics Department
* Statistics Department
* Zoology Department
* Faculty of Journalism and Mass Communication
* Banking & Finance Department
* Software Development & E-Governance Department","The college has 18 departments. Students can find programs and courses offered in:
* Anthropology, Economics, Education, English, Geography, Hindi, Political Science, History, Psychology, Physical Education, Botany, Computer Science, Physics & Electronics, Statistics, Zoology, Journalism and Mass Communication, Banking & Finance, and Software Development & E-Governance.",,,,
83,how can I request subject change or additional subject approval?,Requests for subject change or additional subjects must be made through the Principal.,"To request a subject change or an additional subject, the request must be made through the Principal.",All requests related to subject changes or the addition of subjects must be submitted through the Principal.,"If you want to change a subject or add another one, you’ll need to make the request through the Principal.",,
84,who should I contact for lost things in the department building?,"Report the details of the missing or lost item to a concerned teacher, and check with your friends and classmates before escalating the issue to the Head of your Department.",Students should report the details of any missing or lost item to a concerned teacher and verify with friends and classmates before escalating the matter to the Head of the Department.,"Details of missing or lost items must be reported to the concerned teacher, and students are advised to consult friends and classmates prior to escalating the issue to the Head of the Department.","If you’ve lost something, first let a concerned teacher know and check with your friends or classmates before taking it to the Head of your Department.",,
,where is the auditorium 1 located?,Auditorium 1 is located inside the Science Block. It can be found down the stairs on the right side after entering the building.,"After entering the Science Block, go down the stairs on the right side to reach Auditorium 1.",,Auditorium 1 is situated within the Science Block and is accessible by taking the stairs on the right side after entry into the building.,,"As soon as you enter the Science Block, take the stairs on the right and go down—you’ll find Auditorium 1 there."
87,is there any college magazine?,"NPGC publishes its own magazines and periodicals:

Abhivyakti – Annual college magazine featuring poems, stories, articles, news items, photographs, and achievements, with contributions from students and faculty.

In?Sight – Monthly magazine focused on campus events and announcements, also accepting contributions relevant to student activities.
Additional publications include e-newsletters and other scholarly or departmental releases, such as monographs, research papers, leaflets, pamphlets, and souvenirs for special occasions.","NPGC produces several publications for students and faculty. The Abhivyakti is an annual college magazine with poems, stories, articles, news items, photographs, and achievements contributed by both students and faculty. The In?Sight is a monthly magazine highlighting campus events and announcements, and it also welcomes contributions related to student activities. The college also publishes e-newsletters and other scholarly or departmental materials, including monographs, research papers, leaflets, pamphlets, and souvenirs for special occasions.","NPGC publishes official magazines and periodicals, including:

Abhivyakti – An annual college magazine comprising poems, stories, articles, news items, photographs, and achievements, with contributions from students and faculty.

In?Sight – A monthly magazine dedicated to campus events and announcements, which also accepts submissions relevant to student activities.
Additional publications encompass e-newsletters and other scholarly or departmental releases, such as monographs, research papers, leaflets, pamphlets, and souvenirs for special occasions.","NPGC has its own magazines and periodicals. Abhivyakti is the annual college magazine, full of poems, stories, articles, news, photos, and achievements from both students and faculty. In?Sight is a monthly magazine about campus events and announcements, and it’s happy to include contributions related to student activities. The college also puts out e-newsletters and other materials like monographs, research papers, leaflets, pamphlets, and souvenirs for special occasions.",,
93,how can students get their work published in college magazines?,Students looking to contribute their work for the college magazine can contact Professor Ramkrishna or email their query at support@npgc.in,"If you wish to contribute to the college magazine, please contact Professor Ramkrishna or send your query via email to support@npgc.in","Students intending to submit contributions for the college magazine may reach out to Professor Ramkrishna or direct their inquiries to support@npgc.in
 via email.","If you want to share your work for the college magazine, you can get in touch with Professor Ramkrishna or just email your query to support@npgc.in",,
109,what is the college office/contact number?,"For any query, contact:
Phone: 0522 4021304
Email: support@npgc.in","If you have any questions or need assistance, please reach out via:
Phone: 0522 4021304
Email: support@npgc.in","For all inquiries, kindly contact the institution at:
Phone: 0522 4021304
Email: support@npgc.in","Got a question? Feel free to call us at 0522 4021304 or drop an email at support@npgc.in
—we’ll be happy to help!",,
110,where is the college located?,"The college is located at:
National Post Graduate College
2, Rana Pratap Marg
Lucknow - 226001
Uttar Pradesh, India. Heres google map link: Full Google Maps Link:
https://www.google.com/maps/place/2+Rana+Pratap+Marg,+Hazratganj,+Lucknow,+Uttar+Pradesh+226001,+India/@26.85674,80.94348,17z","You can visit the college at the following address:
National Post Graduate College
2, Rana Pratap Marg
Lucknow - 226001
Uttar Pradesh, India. Heres google map link: Full Google Maps Link:
https://www.google.com/maps/place/2+Rana+Pratap+Marg,+Hazratganj,+Lucknow,+Uttar+Pradesh+226001,+India/@26.85674,80.94348,17z","The official address of the college is:
National Post Graduate College
2, Rana Pratap Marg
Lucknow - 226001
Uttar Pradesh, India. Heres google map link: Full Google Maps Link:
https://www.google.com/maps/place/2+Rana+Pratap+Marg,+Hazratganj,+Lucknow,+Uttar+Pradesh+226001,+India/@26.85674,80.94348,17z ","The college is right here:
National Post Graduate College
2, Rana Pratap Marg
Lucknow - 226001, Uttar Pradesh, India. Heres google map link: Full Google Maps Link:
https://www.google.com/maps/place/2+Rana+Pratap+Marg,+Hazratganj,+Lucknow,+Uttar+Pradesh+226001,+India/@26.85674,80.94348,17z",,
111,what does it mean by national pg college is autonomous?,"Being autonomous means the college can design its own courses, syllabus, and academic curriculum instead of strictly following Lucknow University, with which it is affiliated. The college can independently:
Conduct internal assessments and final exams
Publish its own results
Set academic calendars","As an autonomous institution, the college can tailor its courses, syllabus, and curriculum to better suit students’ needs rather than strictly following Lucknow University. It also independently manages:
Internal assessments and final exams
Publication of results
Academic calendars","Autonomy enables the college to independently design courses, syllabus, and academic curriculum while remaining affiliated with Lucknow University. The college possesses the authority to:
Conduct internal assessments and final examinations
Publish results
Establish academic calendars","Being autonomous basically means the college has the freedom to create its own courses, syllabus, and curriculum, instead of just following Lucknow University. It can also independently:
Run internal and final exams
Release its own results
Set the academic calendar",,
113,what is this chatbot for?,"The chatbot NPGC Helpdesk has been developed to address students’ queries related to the college, its functioning, departments, and faculty, and to provide centralized information about National PG College. Students are encouraged to share feedback to help improve the chatbot’s effectiveness.","The NPGC Helpdesk chatbot is designed to answer student queries regarding the college, departments, faculty, and overall functioning at a single platform. Students are encouraged to share their feedback and reviews so the chatbot can be improved and made more useful.","The NPGC Helpdesk chatbot has been developed to provide students with information related to National PG College, including its departments, faculty, and administrative functioning, through a single platform. Students are requested to submit their feedback and reviews to assist in enhancing the effectiveness of the chatbot.","The NPGC Helpdesk chatbot is here to answer your questions about the college—how it works, departments, faculty, everything in one place. Drop your feedback and reviews so we can make it actually useful, not just another chatbot.",,
116,are students's complaints kept confidential?,"Yes, complaints submitted by students are kept strictly confidential. All information shared during the grievance process is accessed only by authorized personnel and is used solely for the purpose of resolution. Student privacy is maintained throughout the process.","Yes, student complaints are treated with strict confidentiality. Students can raise concerns without fear of disclosure, as details are shared only with authorized members involved in resolving the issue. This ensures a safe and unbiased grievance-handling process.","Yes, all complaints submitted by students are maintained under strict confidentiality. The institution ensures that grievance details are disclosed only to authorized committee members and are handled in accordance with established norms to protect student privacy and integrity.",Yes—student complaints are kept strictly confidential. Only the people who actually need to handle the issue get access to the details. So students can speak up honestly without worrying about their concerns becoming public gossip.,,
120,how to apply for permission to leave early?,"If a student needs to leave before classes for the day are over, they must submit a written application to the Head of Department or the concerned subject teacher whose class will be missed. The application should clearly state the reason for early departure and include the parent’s contact number at the end.","Students who need to leave the college before their scheduled classes are completed should write an application explaining the reason for early departure. The application must be submitted to the concerned subject teacher or the Head of Department, and the parent’s contact number should be mentioned at the end for verification.",Students intending to leave the college premises before the completion of their scheduled classes are required to submit a written application to the concerned subject teacher or the Head of Department. The application must clearly specify the reason for absence and include the parent’s contact number at the end.,"If you need to leave before your classes end, don’t just disappear. Write an application to your subject teacher or the HOD, explain the reason properly, and add your parent’s contact number at the end. Simple, responsible, done.",,
121,what is the dress code?,The dress code of National Post Graduate College includes a cream-coloured salwar suit with dupatta for female students and a cream-coloured shirt with brown trousers for male students.,"Students of National Post Graduate College are expected to follow the prescribed dress code. Female students should wear a cream-coloured salwar suit with a dupatta, while male students should wear a cream-coloured shirt paired with brown trousers.",Students are hereby informed that the prescribed dress code of National Post Graduate College consists of a cream-coloured salwar suit with dupatta for female students and a cream-coloured shirt with brown trousers for male students. Adherence to the dress code is mandatory.,"The dress code at National Post Graduate College is simple: cream salwar suit with dupatta for girls, and a cream shirt with brown trousers for boys. Follow it—makes life easier for everyone.",,
,how to get enrolled in minor or vocational classes?,Departments display printed notices regarding vocational or minor courses on their bulletin boards. These notices usually include a QR code that students can scan to join the relevant WhatsApp group.,"To join the WhatsApp group for a vocational or minor course, visit the department’s bulletin board and check the printed notice related to the course. The QR code provided on the notice can be scanned to join the group.","To join the WhatsApp group for a vocational or minor course, visit the department’s bulletin board and check the printed notice related to the course. The QR code provided on the notice can be scanned to join the group.",Just check the department’s bulletin board. The vocational or minor course notice usually has a QR code printed on it—scan that to join the WhatsApp group.,,
,,,,,,,
114,what is techfest 5.0?,"TechFest 5.0 at National Post Graduate College (NPGC) is an annual, multi-day, inter-collegiate technical festival organized by the Department of Computer Science. The fest is based on the theme “Innovation | Inspiration | Impact. The event provides students with a platform to showcase skills in coding, e-sports gaming, and digital art, while promoting innovation and creativity. TechFest includes events such as an 8-hour Code-A-Thon and a Tech Debate, with cash prizes and participation certificates.","TechFest 5.0, organized annually by the Department of Computer Science at National Post Graduate College (NPGC), is a multi-day inter-collegiate technical festival designed to encourage innovation and skill development. The fest is based on the theme “Innovation | Inspiration | Impact. Students can participate in events such as an 8-hour Code-A-Thon,  digital art competitions, and a Tech Debate. Cash prizes along with certificates are awarded, making TechFest a strong opportunity for both learning and recognition.","TechFest 5.0 is an annual, multi-day, inter-collegiate technical festival organized by the Department of Computer Science at National Post Graduate College (NPGC). The fest is based on the theme “Innovation | Inspiration | Impact. The festival aims to foster technical competence, innovation, and creativity among students through events such as coding competitions, an 8-hour Code-A-Thon, digital art contests, and a Tech Debate. Cash prizes are awarded for various events along with certificates for all participants.","TechFest 5.0 at National Post Graduate College (NPGC) is where tech brains actually get to show off. The fest is based on the theme “Innovation | Inspiration | Impact. It’s a multi-day, inter-college fest run by the Computer Science department, featuring coding events, an intense 8-hour Code-A-Thon, e-sports, digital art, and even a Tech Debate. There’s real money on the line,  more cash prizes for coding and projects—and everyone walks away with certificates.",,
,What does Techfest 5.0 represent at National PG College?,"Techfest 5.0 represents the fifth edition of the college Techfest at National Post Graduate College, reflecting its continuity, growth, and expansion in scale over the years.","Techfest 5.0 shows that the college has successfully organized four earlier editions, and students can expect a more developed and larger-scale event compared to previous years,","Techfest 5.0 signifies the fifth successful edition of the college Techfest, demonstrating the institution’s commitment to continuity, growth, and expansion of academic and technical events,","Techfest 5.0 simply means it’s the fifth time the college is organizing Techfest, and it has grown bigger with each edition.",,
,What is special about Techfest 5.0?,"Techfest 5.0 at National Post Graduate College is a three-day inter-collegiate event that includes multiple technical, creative, and competitive activities such as expos, coding contests, quizzes, debates, and design events, with a focus on real-world technical problem solving.","Techfest 5.0 is special for students because it is an inter-collegiate, three-day event featuring a wide range of technical, creative, and competitive activities, including expos, coding, quizzes, debates, and design challenges that promote practical problem-solving skills.","Techfest 5.0 is a three-day inter-collegiate technical fest that integrates diverse technical, creative, and competitive events, including expos, coding competitions, quizzes, debates, and design activities, aimed at fostering innovation and real-world technical problem-solving among participants.","Techfest 5.0 is special because it’s a three-day inter-college fest with lots of events like expos, coding, quizzes, debates, and design competitions, all focused on real-world tech problem solving.",,
,What is the theme or vision of Techfest 5.0?,The vision of Techfest 5.0 is based on Innovation and Inspiration and Impact and aims to encourage creativity and technical excellence among students.,The vision of Techfest 5.0 encourages students to innovate stay inspired and build strong technical excellence through creative participation.,The vision of Techfest 5.0 is founded on Innovation and Inspiration and Impact with the objective of promoting creativity and technical excellence among students.,The vision of Techfest 5.0 is about innovation inspiration and impact and helping students grow creatively and technically.,,
,When is Techfest 5.0 conducted?,"Techfest 5.0 at National Post Graduate College is conducted on 12th, 13th and 14th February 2026.",Students interested in participating in Techfest 5.0 should note that the event is scheduled to take place on 12th 13th and 14th February 2026.,Techfest 5.0 is scheduled to be conducted from 12th February 2026 to 14th February 2026 as part of the college’s academic and technical event calendar.,Techfest 5.0 will happen on 12th 13th and 14th February 2026.,,
,How many days does Techfest 5.0 last?,Techfest 5.0 is a three-day event.,Techfest 5.0 is a three-day event.,Techfest 5.0 lasts for three-days.,Techfest 5.0 is a three-day event.,,
,Which department organizes Techfest 5.0?,Techfest 5.0 at National Post Graduate College is organized by the Department of Computer Science.,"Students interested in Techfest 5.0 should note that the event is organized by the Department of Computer Science, which coordinates all technical and academic activities of the fest.",Techfest 5.0 is organized by the Department of Computer Science as part of the institution’s academic and technical initiatives.,Techfest 5.0 is organized by the Computer Science department.,,
,Is Techfest 5.0 an inter-collegiate event?,Yes Techfest 5.0 at National Post Graduate College is an inter-collegiate event allowing participation from students of different colleges.,Students from other colleges are allowed to participate in Techfest 5.0 as it is organized as an inter-collegiate event.,Techfest 5.0 is conducted as an inter-collegiate event enabling participation from students across different institutions.,Yes Techfest 5.0 is an inter-college event so students from other colleges can also take part.,,
,How can I register for Techfest 5.0?,Registrations for Techfest 5.0 at National Post Graduate College are done exclusively through the official Techfest 5.0 website.,Students who wish to participate in Techfest 5.0 must complete their registration through the official Techfest 5.0 website only.,Registration for Techfest 5.0 is accepted exclusively through the official Techfest 5.0 website. No other mode of registration is permitted.,You can register for Techfest 5.0 only through the official Techfest 5.0 website.,,
,Are on-spot registrations allowed?,Some events at Techfest 5.0 allow on-site registration. However participants are encouraged to pre-register online as mentioned in the official brochure.,Participants may register on-site for selected events. However it is recommended to pre-register online in advance as advised in the Techfest 5.0 brochure to avoid last-minute issues.,While limited events permit on-site registration participation is encouraged through prior online registration as specified in the official Techfest 5.0 brochure.,A few events allow on-the-spot registration but it’s better to register online beforehand as mentioned in the brochure.,,
