id,Question,Informational,Guidance oriented,Institutional,Conversational,,
23,what is the minor subjects for 3rd sem students?,The college revises minor subjects periodically to keep pace with academic trends. Students are advised to wait for the official notice listing the available minor subjects and to check their department notice boards or official WhatsApp community groups for updates.,"As minor subjects are updated to align with current academic trends, students should wait for the official notice announcing the list of minor subjects. Regularly checking the department notice board and official WhatsApp community groups will help ensure timely updates.",The college periodically revises minor subjects in accordance with prevailing academic trends. Students are informed that the list of minor subjects will be notified through an official notice. Updates may be accessed via the respective department notice boards and official WhatsApp community groups.,Minor subjects change from time to time to stay relevant. So don’t jump to conclusions—wait for the official notice and keep an eye on your department notice board or WhatsApp group for updates.,,
24,what are the minor subjects for 2nd sem students?,The college revises minor subjects periodically to keep pace with academic trends. Students are advised to wait for the official notice listing the available minor subjects and to check their department notice boards or official WhatsApp community groups for updates.,"As minor subjects are updated to align with current academic trends, students should wait for the official notice announcing the list of minor subjects. Regularly checking the department notice board and official WhatsApp community groups will help ensure timely updates.",The college periodically revises minor subjects in accordance with prevailing academic trends. Students are informed that the list of minor subjects will be notified through an official notice. Updates may be accessed via the respective department notice boards and official WhatsApp community groups.,Minor subjects change from time to time to stay relevant. So don’t jump to conclusions—wait for the official notice and keep an eye on your department notice board or WhatsApp group for updates.,,
25,what are the minor subjects for 1st sem students?,The college revises minor subjects periodically to keep pace with academic trends. Students are advised to wait for the official notice listing the available minor subjects and to check their department notice boards or official WhatsApp community groups for updates.,"As minor subjects are updated to align with current academic trends, students should wait for the official notice announcing the list of minor subjects. Regularly checking the department notice board and official WhatsApp community groups will help ensure timely updates.",The college periodically revises minor subjects in accordance with prevailing academic trends. Students are informed that the list of minor subjects will be notified through an official notice. Updates may be accessed via the respective department notice boards and official WhatsApp community groups.,Minor subjects change from time to time to stay relevant. So don’t jump to conclusions—wait for the official notice and keep an eye on your department notice board or WhatsApp group for updates.,,
26,list the UG course I can apply for?,"The following undergraduate (UG) courses are offered by National PG College: B.A., B.Com., B.Sc., B.B.A., B.B.A. (MS) (discontinued from 2023), B.B.A. (Digital Business), B.C.A., B.Com. (Hons.), B.Com. (eCommerce), B.Voc. (Software Development & E-Governance), B.Voc. (Banking & Finance), B.A.J.M.C., and B.P.H. For more information, visit https://www.npgc.in/Academics-CoursesUG.aspx","National PG College offers a range of undergraduate programs, including B.A., B.Com., B.Sc., B.B.A., and B.B.A. (Digital Business). Other UG courses include B.C.A., B.Com. (Hons.), B.Com. (eCommerce), B.Voc. programs in Software Development & E-Governance and Banking & Finance, B.A.J.M.C., and B.P.H. Please note that B.B.A. (MS) has been discontinued from 2023. For more information, visit https://www.npgc.in/Academics-CoursesUG.aspx","National PG College offers the following Undergraduate (UG) programs: Bachelor of Arts (B.A.), Bachelor of Commerce (B.Com.), Bachelor of Science (B.Sc.), Bachelor of Business Administration (B.B.A.), Bachelor of Business Administration (MS) (discontinued from 2023), Bachelor of Business Administration (Digital Business), Bachelor of Computer Applications (B.C.A.), Bachelor of Commerce (Honours), Bachelor of Commerce (eCommerce), Bachelor of Vocation in Software Development & E-Governance, Bachelor of Vocation in Banking & Finance, Bachelor of Arts in Journalism and Mass Communication (B.A.J.M.C.), and Bachelor of Public Health (B.P.H.). For more information, visit https://www.npgc.in/Academics-CoursesUG.aspx","National PG College offers several UG courses like B.A., B.Com., B.Sc., B.B.A., B.B.A. (Digital Business), and B.C.A. You can also choose from courses such as B.Com. (Hons.), B.Com. (eCommerce), B.Voc. programs in Software Development & E-Governance and Banking & Finance, B.A.J.M.C., and B.P.H. Please note that B.B.A. (MS) has been discontinued from 2023. For more information, visit https://www.npgc.in/Academics-CoursesUG.aspx",,
27,list the PG course I can apply for?,"The following postgraduate (PG) courses are offered by National PG College: M.A./M.Sc. (Anthropology), M.A. (Economics), M.A. (English), M.A. (Geography), M.A. (Political Science), M.A. (Psychology), M.Sc. (Chemistry), M.Sc. (Geoinformatics), M.Com, M.Voc. (Software & E-Governance), M.Voc. (Banking, Stock & Insurance), and M.P.H. (Master in Public Health). For more information, visit: https://www.npgc.in/Academics-CoursesPG.aspx","National PG College offers a variety of postgraduate programs, including M.A./M.Sc. in Anthropology, M.A. programs in Economics, English, Geography, Political Science, and Psychology, as well as M.Sc. programs in Chemistry and Geoinformatics. Other PG courses include M.Com, M.Voc. in Software & E-Governance, M.Voc. in Banking, Stock & Insurance, and M.P.H. (Master in Public Health). For more information, visit: https://www.npgc.in/Academics-CoursesPG.aspx","National PG College offers the following Postgraduate (PG) programs: Master of Arts/Master of Science (Anthropology), Master of Arts in Economics, English, Geography, Political Science, and Psychology, Master of Science in Chemistry and Geoinformatics, Master of Commerce, Master of Vocation in Software & E-Governance, Master of Vocation in Banking, Stock & Insurance, and Master of Public Health (M.P.H.). For more information, visit: https://www.npgc.in/Academics-CoursesPG.aspx","At National PG College, you can choose from several PG courses such as M.A./M.Sc. (Anthropology), M.A. programs in Economics, English, Geography, Political Science, and Psychology, and M.Sc. programs in Chemistry and Geoinformatics. The college also offers M.Com, M.Voc. in Software & E-Governance, M.Voc. in Banking, Stock & Insurance, and M.P.H. in Public Health. For more information, visit: https://www.npgc.in/Academics-CoursesPG.aspx",,
28,what are the certificate courses I can apply for?,"The following certificate courses are offered at National PG College: Certificate Course in Forensic Science – Anthropology Department, Certificate Course in Psychological Counseling – Psychology Department, Effective Communication in English – Computer Science Department, Certificate Course in Computer Science – Computer Science Department, Introduction to Blockchain Technology and Application – Computer Science Department, and Certificate in Robotics and Artificial Intelligence – Physics Department. For more information, visit: https://www.npgc.in/Academics-CoursesCertification.aspx","National PG College offers several certificate courses across departments. You can take the Certificate Course in Forensic Science from the Anthropology Department, or the Certificate Course in Psychological Counseling from the Psychology Department. The Computer Science Department offers Effective Communication in English, a Certificate Course in Computer Science, and Introduction to Blockchain Technology and Application. The Physics Department offers a Certificate in Robotics and Artificial Intelligence. For more information, visit: https://www.npgc.in/Academics-CoursesCertification.aspx","The following certificate programs are available at National PG College: Certificate Course in Forensic Science (Anthropology Department), Certificate Course in Psychological Counseling (Psychology Department), Effective Communication in English (Computer Science Department), Certificate Course in Computer Science (Computer Science Department), Introduction to Blockchain Technology and Application (Computer Science Department), and Certificate in Robotics and Artificial Intelligence (Physics Department). For more information, visit: https://www.npgc.in/Academics-CoursesCertification.aspx","You can enroll in several certificate courses at National PG College: Forensic Science with the Anthropology Department, Psychological Counseling with the Psychology Department, Effective Communication in English, Certificate in Computer Science, and Introduction to Blockchain Technology with the Computer Science Department, and Robotics and Artificial Intelligence with the Physics Department. For more information, visit: https://www.npgc.in/Academics-CoursesCertification.aspx",,
30,from where can i download my course syllabus?,"To access the syllabus, go to the college website, click the three lines on the side of the blue bar, select Students Corner, then choose Downloads, and finally select Syllabus from the drop-down menu. Heres the link: https://www.npgc.in/StudentSupport-Downloads.aspx","You can find the syllabus by visiting the college website. Click the three lines on the blue bar, go to Students Corner, select Downloads, and then pick Syllabus from the drop-down menu. Here's the link: https://www.npgc.in/StudentSupport-Downloads.aspx","To download the syllabus, please navigate to the college website, click the menu icon on the blue bar, access Students Corner, select Downloads, and choose Syllabus from the drop-down options. Heres the link: https://www.npgc.in/StudentSupport-Downloads.aspx","Want to check the syllabus? Head to the college website, tap the three-line menu on the blue bar, go to Students Corner, click Downloads, and then select Syllabus from the drop-down. Heres the link: https://www.npgc.in/StudentSupport-Downloads.aspx",,
,,,,,,,
1, what is the exam schedule/timetable?,The exam schedule is shared in the WhatsApp community group by the Head of Department. It is also available on the college website and on the notice board. Here's the link for Examination Datesheet: https://www.npgc.in/StudentSupport-Datesheet.aspx,"You can find the exam schedule in the WhatsApp community group shared by the Head of Department. It is also published on the college website, and updates are posted on the notice board. Here's the link for Examination Datesheet, which is frequently updated before semester exams: https://www.npgc.in/StudentSupport-Datesheet.aspx",The examination schedule is communicated by the Head of Department through the WhatsApp community group. It can also be accessed on the college website or checked on the notice board. Here's the link for Examination Datesheet: https://www.npgc.in/StudentSupport-Datesheet.aspx,The Head of Department usually shares the exam schedule in the WhatsApp community group. You can also check the college website or the notice board for the latest updates. Here's the link for Examination Datesheet: https://www.npgc.in/StudentSupport-Datesheet.aspx,,
3,how to see/check exam result on website?," To check the results, navigate to the college website, tap the three lines on the side of the blue bar, go to Student Corner, select the Results option, and enter your Student ID. Link for results: https://result.npgc.in/","You can view your results by visiting the college website, tapping the three lines on the blue bar, selecting Student Corner, choosing the Results option, and entering your Student ID. Link for results: https://result.npgc.in/","Students may access their results by visiting the college website, selecting the three-line menu on the blue bar, navigating to Student Corner, choosing the Results option, and entering their Student ID. Link for results: https://result.npgc.in/","To see your results, go to the college website, tap the three-line menu on the blue bar, open Student Corner, select Results, and enter your Student ID.  Link for results: https://result.npgc.in/                                                                                                      ",,
4,how to apply for backpaper?,"Students may raise their queries regarding back paper forms or related fees at Counter 4 in the Administrative Department. Alternatively, they may contact the concerned subject teacher or the Head of Department (HOD).","For queries related to back paper forms or fees, students should first approach Counter 4 in the Administrative Department. If further clarification is required, they may contact the concerned subject teacher or the Head of Department (HOD).","Students are hereby informed that queries pertaining to back paper forms and fees may be addressed at Counter 4 of the Administrative Department. Additionally, students may contact the concerned subject teacher or the Head of Department (HOD) for academic clarification.","Got questions about back paper forms or fees? Start with Counter 4 in the administrative department. If that doesn’t clear things up, talk to your subject teacher or the HOD.",,
5,how do I get my exam marksheet?,Students can collect their marksheet from Counter No. 6 in the administrative department. An old library card or ID card may be required for verification,Students may retrieve their marksheet from Counter No. 6 at the administrative department. Please note that you may be asked to show your old library card or ID card.,Students are informed that marksheets can be obtained from Counter No. 6 of the administrative department. Submission of an old library card or ID card may be required.,"You can collect your marksheet from Counter No. 6 in the administrative department. Just make sure to carry your old library card or ID card, as it may be needed.",,
6,how to fill the examination form?,First-year students must fill and submit the examination form in the college. Senior students can fill and submit the examination form online through the college website. The related instructions are available on the ID and password page. Heres the link for Examination Form: https://exam.npgc.in/,"If you are a first-year student, the examination form needs to be filled and submitted at the college. Senior students can complete and submit the form online on the college website, and the instructions are provided on the ID and password page. Heres the link for Examination Form: https://exam.npgc.in/","For first-year students, the examination form must be filled and submitted at the college. Senior students are permitted to fill and submit the examination form online through the college website. Instructions regarding the process are mentioned on the ID and password page. Heres the link for Examination Form: https://exam.npgc.in/",First-year students need to fill out and submit the examination form in college. Senior students can do this online through the college website. You’ll find the instructions on the ID and password page. Heres the link for Examination Form: https://exam.npgc.in/,,
7,what is the marks distribution of the exams?,"For theory subjects, the semester-end examination carries 70 marks and internal assessment carries 30 marks, which includes a written test of 20 marks, attendance of 5 marks, and behavioural conduct of 5 marks. For practical subjects, the semester-end practical examination carries 70 marks and internal assessment carries 30 marks, which includes internal practical of 20 marks, viva-voce of 5 marks, and practical file of 5 marks. The grading system follows CBCS with letter grades and grade points on a 10-point scale. For more information, visit https://www.npgc.in/Academics-ExamAssesCBCS.aspx","In theory subjects, students are evaluated through a 70-mark semester-end examination and a 30-mark internal assessment consisting of a written test (20 marks), attendance (5 marks), and behavioural conduct (5 marks). For practical subjects, evaluation includes a 70-mark semester-end practical examination and a 30-mark internal assessment comprising internal practical (20 marks), viva-voce (5 marks), and practical file (5 marks). The college follows the CBCS grading system with letter grades and grade points based on a 10-point scale. For more information, visit https://www.npgc.in/Academics-ExamAssesCBCS.aspx","The evaluation scheme for theory subjects includes a semester-end examination of 70 marks and an internal assessment of 30 marks, comprising a written test (20 marks), attendance (5 marks), and behavioural conduct (5 marks). For practical subjects, assessment consists of a semester-end practical examination of 70 marks and an internal assessment of 30 marks, including internal practical (20 marks), viva-voce (5 marks), and practical file (5 marks). Grading is conducted under the CBCS system using letter grades and grade points on a 10-point scale. For more information, visit https://www.npgc.in/Academics-ExamAssesCBCS.aspx","For theory subjects, you’ll have a 70-mark semester-end exam and 30 marks for internal assessment, which includes a written test, attendance, and behavioural conduct. Practical subjects also have a 70-mark semester-end practical exam and 30 marks for internal assessment, covering internal practicals, viva-voce, and the practical file. The college follows the CBCS grading system with letter grades on a 10-point scale. For more information, visit https://www.npgc.in/Academics-ExamAssesCBCS.aspx",,
8,when are internal assessments/tests conducted?,"Internal tests are conducted twice in a semester before the final external examinations. Each test usually covers two units and is conducted for 20 marks. For more information on exams and assessments, visit https://www.npgc.in/Academics-ExamAssesCBCS.aspx","The college conducts two internal tests in each semester before the final external exams. Each internal test generally includes two units and is evaluated for 20 marks. For more information on exams and assessments, visit https://www.npgc.in/Academics-ExamAssesCBCS.aspx","Internal tests are conducted twice during each semester prior to the final external examinations. Each test typically covers two units and carries a total of 20 marks. For more information on exams and assessments, visit https://www.npgc.in/Academics-ExamAssesCBCS.aspx","There are two internal tests in each semester before the final external exams. Each test usually covers two units and is held for 20 marks. For more information on exams and assessments, visit https://www.npgc.in/Academics-ExamAssesCBCS.aspx",,
9,whom to contact for exam related issues?,Any exam-related problem can be resolved by consulting your subject teacher or the Head of Department.,"If you face any issues related to exams, you can easily get them resolved by speaking with your subject teacher or the Head of Department.",Students encountering any examination-related issues are advised to consult their respective subject teacher or the Head of Department for resolution.,"If you have any questions or problems about exams, just reach out to your subject teacher or the Head of Department—they’ll be able to help.",,
12,what are the exam rules?,All rules for the examination hall are mentioned in the examination form or on your admit card. Students are advised to read them carefully and follow them.,The rules that must be followed in the exam hall are listed in your examination form or admit card. Make sure to read them thoroughly and adhere to them during exams.,Students are informed that all regulations pertaining to conduct in the examination hall are detailed in the examination form or on the admit card. Strict compliance with these rules is expected.,All the exam hall rules are mentioned in your exam form or admit card. Make sure you read them carefully and follow them during the exam.,,
71, What is the exam grading system ?,"The college follows a semester system with two semesters each academic year.
Each course is evaluated through Continuous Internal Assessment (CIA) and a Semester-End Examination.

Marks obtained are converted into Grade Points (GP) and Letter Grades using a 10-point scale.
Grades O, A+, A, B+, B, C, and D are considered passing grades, while scores below the required level are given an F grade. 
SGPA represents performance in a single semester.
CGPA represents overall academic performance across all completed semesters.  For more detailed information, visit: https://www.npgc.in/Academics-ExamAssesCBCS.aspx                                                                                                                                                                                                               ","The academic structure is based on a semester system consisting of two semesters per academic year.
Assessment for every course includes Continuous Internal Assessment (CIA) and a Semester-End Examination.

Students’ marks are converted into Grade Points and Letter Grades using a 10-point grading scale.
Grades from O to D indicate successful completion of a course, whereas scores below the required level are awarded an F grade.

The Semester Grade Point Average (SGPA) reflects performance for an individual semester.
The Cumulative Grade Point Average (CGPA) reflects overall academic performance across all semesters completed. For more detailed information, visit: https://www.npgc.in/Academics-ExamAssesCBCS.aspx","The institution adopts a semester-based academic system comprising two semesters in an academic year.
Each paper or course is assessed through Continuous Internal Assessment (CIA) and a Semester-End Examination.

Student performance is evaluated by converting marks into Grade Points (GP) and Letter Grades as per a 10-point scale.
Grades O, A+, A, B+, B, C, and D are designated as passing grades, while performance below the prescribed standard is recorded as F (Fail).

SGPA (Semester Grade Point Average) represents performance in a single semester.
CGPA (Cumulative Grade Point Average) represents cumulative performance across all completed semesters. For more detailed information, visit: https://www.npgc.in/Academics-ExamAssesCBCS.aspx","The college follows a semester system, with two semesters each year.
Every subject is assessed using Continuous Internal Assessment (CIA) and a Semester-End Exam.

Your marks are converted into Grade Points and Letter Grades on a 10-point scale.
Grades like O, A+, A, B+, B, C, and D mean you’ve passed, while an F grade means you haven’t met the passing criteria.

SGPA shows how you performed in one semester.
CGPA shows your overall performance across all the semesters you’ve completed. For more detailed information, visit: https://www.npgc.in/Academics-ExamAssesCBCS.aspx",,
80,what are the rules for internal assessments?,Internal assessment rules follow the college norms.,Please ensure that all internal assessments adhere to the rules set by the college.,Internal assessment regulations are implemented in accordance with the established college norms.,,,
,,,,,,,
43,how do I get a library card?,Students applying for a library card for the first time must present their ID card. Students re-applying for a library card are required to have their old library card verified to ensure that books from the previous semester have been returned before a new card is issued.,"First-time applicants for a library card should carry their ID card for verification. Students applying for renewal must first get their old library card checked to confirm that all previously issued books have been returned, after which a new card will be issued.",Students applying for a library card for the first time are required to present their valid ID card. Students seeking re-issuance of a library card must ensure verification of their previous library card to confirm the return of all books from the earlier semester before a new card is issued.,"If you’re applying for a library card for the first time, bring your ID card. If you’re reapplying, get your old library card checked first—it’s to confirm you returned last semester’s books. No clearance, no new card.",,
44, What happens if I lose a library card?,"A duplicate library card is issued in cases where the previous library card is lost or damaged, upon payment of ?50.","If a library card is lost or torn, students can apply for a duplicate card by paying a fee of ?50 to the library.","In the event of loss or damage to a library card, a duplicate library card will be issued upon payment of a fee of ?50.",Lost or torn your library card? No drama—a duplicate will be issued once you pay ?50.,,
