id,Question,Informational,Guidance oriented,Institutional,Conversational,,
1,who is the Head of the Hindi Department?,Prof. Ramkrishna is the Head of the Hindi Department.,Students should note that Prof. Ramkrishna serves as the Head of the Hindi Department.,Prof. Ramkrishna holds the position of Head of the Hindi Department.,Prof. Ramkrishna is the Head of the Hindi Department.,,
,,,,,,,
2,who is the Head of Department (HOD) of zoology Department?,Dr. Gyanendra Kumar is the Head of the Zoology Department.,Students should note that Dr. Gyanendra Kumar serves as the Head of the Zoology Department.,Dr. Gyanendra Kumar holds the position of Head of the Zoology Department.,Dr. Gyanendra Kumar is the Head of the Zoology Department.,,
3,where is the Zoology department office located?,The Zoology department office is located on the first floor of the Science Block.,Students can visit the Zoology department office on the first floor of the Science Block.,It is hereby informed that the Zoology department office is situated on the first floor of the Science Block.,You’ll find the Zoology department office on the first floor of the Science Block.,,
,,,,,,,
4,who is the Head of the Department (HOD) of English Department?,Dr. Binu Singh is the Head of the English Department.,Students should note that Dr. Binu Singh serves as the Head of the English Department.,Dr. Binu Singh holds the position of the Head of English Department.,Dr. Binu Singh is the Head of the English Department.,,
,,,,,,,
5,who is the Head of the Department (HOD) of Botany Department?,Dr. Avijeet Chatterjee is the Head of the Botany Department.,Students should note that Dr. Avijeet Chatterjee serves as the Head of the Botany Department.,Dr. Avijeet Chatterjee holds the position of the Head of Botany Department.,Dr. Avijeet Chatterjee is the Head of the Botany Department.,,
6,where is the Botany department office located?,The Botany department office is located on the first floor of the Science Block.,Students can visit the Botany department office on the first floor of the Science Block.,It is hereby informed that the Botany department office is situated on the first floor of the Science Block.,You’ll find the Botany department office on the first floor of the Science Block.,,
,,,,,,,
7,who is the Head of the Department (HOD) of Mathematics Department?,Dr. Bhanu Pratap Singh is the Head of the Mathematics Department.,Students should note that Dr. Bhanu Pratap Singh serves as the Head of the Mathematics Department.,Dr. Bhanu Pratap Singh holds the position of Head of the Mathematics Department.,Dr. Bhanu Pratap Singh is the Head of the Mathematics Department.,,
8,where is the Mathematics department office located?,The Mathematics department office is located on the second floor of the Science Block.,Students can visit the Mathematics department office on the second floor of the Science Block.,It is hereby informed that the Mathematics department office is situated on the second floor of the Science Block.,You’ll find the Mathematics department office on the second floor of the Science Block.,,
9,who is the Head of the Department (HOD) of Statistics Department?,Dr. Nishi Rastogi is the Head of the statistics Department.,Students should note that Dr. Nishi Rastogi serves as the Head of the Statistics Department.,Dr. Nishi Rastogi holds the position of Head of the Statistics Department.,Dr. Nishi Rastogi is the Head of the Statistics Department.,,
10,where is the Statistics department office located?,The Statistics department office is located on the second floor of the Science Block.,Students can visit the  Statistics department office on the second floor of the Science Block.,It is hereby informed that the  Statistics department office is situated on the second floor of the Science Block.,You’ll find the  Statistics department office on the second floor of the Science Block.,,
,,,,,,,
11,who is the Head of the Department (HOD) of Chemistry Department?,Dr. Vikas Singh is the Head of the Chemistry Department.,Students should note that Dr. Vikas Singh serves as the Head of the Chemistry Department.,Dr. Vikas Singh holds the position of Head of the Chemistry Department.,Dr. Vikas Singh is the Head of the Chemistry Department.,,
12,where is the chemistry lab located? ,The Chemistry Department lab is located on the first floor of the Science Block.,Students can access the Chemistry Department lab on the first floor of the Science Block.,It is hereby informed that the laboratory of the Chemistry Department is situated on the first floor of the Science Block.,You’ll find the Chemistry Department lab on the first floor of the Science Block.,,
13,what are the office hours of the chemistry department?,The Chemistry department office is open from 8:00 AM to 2:00 PM.,"If you need assistance from the Chemistry department office, please visit between 8:00 AM and 2:00 PM.",The Chemistry Department office hours are from 8:00 AM to 2:00 PM.,"The Chemistry office is open from 8 in the morning until 2 in the afternoon, so you can drop by anytime then.",,
14,what are the chemistry lab safety guidelines I need to follow?,Lab safety guidelines are clearly mentioned on the lab notice board. Students must read them thoroughly and follow each guideline to avoid accidents in the lab.,Students should carefully read the lab safety guidelines posted on the lab notice board and follow all instructions to prevent accidents in the lab.,All laboratory safety guidelines are displayed on the lab notice board. Students are required to read these guidelines carefully and adhere to them to ensure safety and prevent accidents.,The lab notice board has all the safety rules listed. Make sure to read them carefully and follow every rule so that no accidents happen in the lab.,,
15,are there any internship opportunities provided by the chemistry department?,No; the Chemistry Department itself does not provide internship opportunities to students.,No; students should note that the Chemistry Department does not directly offer internship opportunities.,The Chemistry Department does not provide internship opportunities to students.,Nope; the Chemistry Department doesn’t offer internships to students.,,
,,,,,,,
16,who is the Head of the Department (HOD) of Physics Department?,Dr. Aparna Singh is the Head of the Physics Department.,Students should note that Dr. Aparna Singh serves as the Head of the Physics Department.,Dr. Aparna Singh holds the position of Head of the Physics Department.,,,
17,where is the physics department office located?,The Physics department office is located on the second floor of the Science Block.,Students can visit the Physics department office on the second floor of the Science Block.,It is hereby informed that the Physics department office is situated on the second floor of the Science Block.,You’ll find the Physics department office on the second floor of the Science Block.,,
,,,,,,,
18,who is the Head of the Department (HOD) of Commerce Department?,Dr.Jyoti Bhargava is the Head of the Commerce Department.,Students should note that Dr. Jyoti Bhargava serves as the Head of the Commerce Department.,Dr. Jyoti Bhargava holds the position of Head of the Commerce Department.,,,
19,where is the commerce department office located?,The Commerce department office is located on the second floor of the Academic Block.,Students can visit the Commerce department office on the second floor of the Academic Block.,It is hereby informed that the Commerce department office is situated on the  second floor of the Academic Block.,You’ll find the Commerce department office on the second floor of the Academic Block.,,
,,,,,,,
20,who is the head of software development and e-governance department?,Dr. Amitabha Yadav is the Head of the software development and e-governance Department.,Students should note that Dr. Amitabha Yadav serves as the Head of the software development and e-governance Department.,Dr. Amitabha Yadav holds the position of Head of the software development and e-governance Department.,Dr. Amitabha Yadav is the Head of the software development and e-governance Department.,,
21,where is the Software development and E- governance department office located? ,The Software development and E- governance department office is located on the third floor of the Administrative Block.,Students can access the Software development and E- governance department office on the third floor of the Administrative Block.,It is hereby informed that the laboratory of the Software development and E- governance department office is situated on the third floor of the Administrative Block.,You’ll find the Software development and E- governance department office on the third floor of the Administrative Block.,,
22,what is the approximate fee for software development and e-governance course?,"The fee for the Software Development and E-Governance course is approximately ?26,500 per semester. In addition, ?5,000 is charged as caution money, which is refundable at the end of the course.","The total fee for the Software Development and E-Governance course is approximately ?26,500 per semester. Students are also required to deposit ?5,000 as caution money, which will be refunded after successful completion of the course.","The prescribed fee for the Software Development and E-Governance course is approximately ?26,500 per semester. A refundable caution money of ?5,000 is also applicable and will be returned at the end of the course, subject to institutional rules.","The course fee is around ?26,500 per semester, and you’ll also need to pay ?5,000 as caution money. Don’t worry—this amount is refundable once the course ends.",,
23,Does the Software Development and E-Governance department offer any specialization courses?,The Software Development and E-Governance department offers a specialization course in Animation. Students are awarded a certificate upon successful completion of the course.,The Software Development and E-Governance department offers a specialization course in Animation. Students who enroll and successfully complete this course will receive a certificate. Interested students should follow the department’s instructions for enrollment.,"The Software Development and E-Governance department offers a specialization course in Animation. Students who successfully complete the course are eligible to receive a certificate issued by the department, as per institutional guidelines.","Yes, the department offers a specialization course in Animation. If you complete it successfully, you’ll get a certificate at the end.",,
,,,,,,,
24,who is the Head of the Computer Science Department?,Dr. Shalini Lamba is the Head of the Computer Science Department.,Students should note that Dr. Shalini Lamba serves as the Head of the Computer Science Department.,Dr. Shalini Lamba holds the position of Head of the Computer Science Department.,Dr. Shalini Lamba is the Head of the Computer Science Department.,,
25,are there any internship opportunities provided by the Computer Science Department?,"Yes, the Computer Science Department provides internship opportunities.",Students can explore internship opportunities offered by the Computer Science Department.,It is hereby informed that the Computer Science Department facilitates internship opportunities for students.,Yes! The Computer Science Department also offers internship opportunities for students.,,
26,how can I report lab equipment or software issues in the Computer Science Department?   ,You should report any lab equipment or software issues to the Head of the Department (HOD).,Students are advised to report any issues with lab equipment or software directly to the Head of the Department (HOD).,Any problems related to laboratory equipment or software should be reported to the Head of the Department (HOD).,"If you face any issues with lab equipment or software, just let the Head of the Department (HOD) know.",,
27,are there any specialization courses in the Computer Science Department?,"Yes, the Computer Science Department does offer specialization courses.",Students should note that the Computer Science Department provides specialization courses to students.,It is hereby informed that the Computer Science Department does  offer specialization courses.,Yes! The Computer Science Department have specialization courses for students.,,
28,where is the lab of the Computer Science located?,"Two computer labs, Lab1 and Lab2, are located on the ground floor of the Science Block. The other two labs, Lab3 and Lab4, are located in the Administrative Department.",Lab1 and Lab2 are located on the ground floor of the Science Block. Lab3 and Lab4 are situated in the Administrative Department. Students should visit the respective buildings based on the lab allotted to them.,"The institution has four computer laboratories. Lab1 and Lab2 are located on the ground floor of the Science Block, while Lab3 and Lab4 are housed in the Administrative Department.",Lab1 and Lab2 are on the ground floor of the Science Block. The other two labs—Lab3 and Lab4—are in the Administrative Department.,,
29,how many labs are there in the Computer Science Department?,The Computer Science Department has four labs.,Students can make use of the 4 labs available in the Computer Science Department.,The Computer Science Department is equipped with four laboratories.,The Computer Science Department has four labs.,,
,,,,,,,
30,who is the Head of the Psychology Department?,Dr. Jagriti Shukla is the Head of the Psychology Department.,Students should note that Dr. Jagriti Shukla serves as the Head of the Psychology Department.,Dr. Jagriti Shukla holds the position of Head of the Psychology Department.,Dr. Jagriti Shukla is the Head of the Psychology Department.,,
31,how many labs in Psychology Department?,The Psychology Department has one laboratory.,Students can make use of the laboratory available in the Psychology Department.,The Psychology Department is equipped with one laboratory.,The Psychology Department has a single laboratory.,,
32,are there any internship opportunities provided by the Psychology Department?,"Yes, the Psychology Department provides internship opportunities. Contact the Head of your department for detailed information.",Students can explore internship opportunities offered by the Psychology Department. Contact the Head of your department for detailed information.,"It is hereby informed that the Psychology Department facilitates internship opportunities for students. For more information, Contact the Head of your department.",Yes! The Psychology Department also offers internship opportunities for students. Contact the Head of your department for detailed information.,,
33,are there any specialization courses in the Psychology Department?,"No, the Psychology Department does not offer any specialization courses.",Students should note that the Psychology Department currently does not provide any specialization courses.,It is hereby informed that the Psychology Department does not offer any specialization courses.,Nope! The Psychology Department doesn’t have any specialization courses.,,
34,where is the lab of the Psychology Department located?,The Psychology Department lab is located on the second floor of the Academic Block.,Students can access the Psychology Department lab on the second floor of the Academic Block.,The laboratory of the Psychology Department is situated on the second floor of the Academic Block.,The Psychology Department lab is on the second floor of the Academic Block.,,
,,,,,,,
35,who is the Head of the Management Department?,Dr. Nidhi Srivastava is the Head of the Management Department.,Students should note that Dr. Nidhi Srivastava serves as the Head of the Management Department.,Dr. Nidhi Srivastava holds the position of Head of the Management Department.,Dr. Nidhi Srivastava is the Head of the Management Department.,,
36,are there any internship opportunities provided by the Management Department?,"Yes, the Management Department provides internship opportunities.",Students can explore internship opportunities offered by the Management Department.,It is hereby informed that the Management Department facilitates internship opportunities for students.,Yes! The Management Department also offers internship opportunities for students.,,
37,are there any specialization courses in the Management Department?,"Yes, the Management Department offers specialization courses in Digital Business, Personal Finance and Wealth Management.",Students can choose specialization courses in Digital Business or Personal Finance and Wealth Management offered by the Management Department.,It is hereby informed that the Management Department provides specialization courses in Digital Business and in Personal Finance and Wealth Management.,Yes! The Management Department offers specializations in Digital Business and Personal Finance & Wealth Management.,,
38,where is the lab of the Management Department located?,The Management Department lab is located on the third floor of the Science Block.,Students can access the Management Department lab on the third floor of the Science Block.,It is hereby informed that the laboratory of the Management Department is situated on the third floor of the Science Block.,You’ll find the Management Department lab on the third floor of the Science Block.,,
39,how many labs are there in the Management Department?,The Management Department has one laboratory.,Students can make use of the laboratory available in the Management Department.,The Management Department is equipped with one laboratory.,The Management Department has a single laboratory.,,
,,,,,,,
40,who is the Head of the bachelor of journalism and mass communication (bajmc) Department?,Dr. Bushra Tufail is the Head of the bachelor of journalism and mass communication (bajmc) Department.,Students should note that Dr. Bushra Tufail serves as the Head of the bachelor of journalism and mass communication (bajmc) Department.,Dr. Bushra Tufail holds the position of Head of the bachelor of journalism and mass communication (bajmc) Department.,Dr. Bushra Tufail is the Head of the bachelor of journalism and mass communication (bajmc) Department.,,
41,where is the bachelor of journalism and mass communication (bajmc) Department office located?,"The bachelor of journalism and mass communication (bajmc) Department office is located on the third floor of the Academic Block, Room 306.","Students can visit the bachelor of journalism and mass communication (bajmc) Department office on the third floor of the Academic Block, Room 306.","It is hereby informed that the office of the bachelor of journalism and mass communication (bajmc) Department is situated on the third floor of the Academic Block, Room 306.","You’ll find the bachelor of journalism and mass communication (bajmc) Department office on the third floor of the Academic Block, Room 306.",,
42,what is the approximate fee for bachelor of journalism and mass communication (bajmc) course?,"The fee for the bachelor of journalism and mass communication (bajmc) course is approximately ?1,68,000 for full program. ","The total fee for the bachelor of journalism and mass communication (bajmc) course is approximately ?1,68,000 for full program. Students are also required to deposit ?5,000 as caution money, which will be refunded after successful completion of the course.","The prescribed fee for the bachelor of journalism and mass communication (bajmc) course is approximately ?1,68,000 for full program. ","The course fee for bajmc is around ?1,68,000 for full program, ",,
,,,,,,,
,what is Deen Dayal Upadhyay Kaushal Kendra (DDUKK)? ,"Deen Dayal Upadhyay Kaushal Kendra (DDUKK) is a skill-development centre functioning under National P.G. College, affiliated to Lucknow University and accredited by NAAC.","If you are looking for skill-based vocational education, DDUKK offers structured programs aligned with industry requirements under National P.G. College.","Deen Dayal Upadhyay Kaushal Kendra is an institutional skill development centre of National P.G. College, operating as per UGC and NSQF guidelines.","Deen Dayal Upadhyay Kaushal Kendra is an institutional skill development centre of National P.G. College, operating as per UGC and NSQF guidelines. Basically, DDUKK is the vocational and skill-development wing of National P.G. College.",,
,what are the courses taught at Deen Dayal Upadhyay Kaushal Kendra (DDUKK) at undergraduate (UG) level?,DDUKK offers B.Voc programs in Software Development & E-Governance and Banking & Finance.,Students interested in vocational undergraduate programs can choose between B.Voc in Software Development & E-Governance or B.Voc in Banking & Finance.,The Kendra offers undergraduate vocational programs including B.Voc in Software Development & E-Governance and B.Voc in Banking & Finance.,You can do a B.Voc here either in Software & E-Governance or in Banking & Finance.,,
,what are the courses taught at Deen Dayal Upadhyay Kaushal Kendra (DDUKK) at postgraduate (PG) level?,"DDUKK offers M.Voc programs in Software & E-Governance and Banking, Stocks & Insurance.","Graduates can apply for M.Voc programs in Software & E-Governance or Banking, Stocks & Insurance, depending on their academic background.","Postgraduate vocational programs offered include M.Voc in Software & E-Governance and M.Voc in Banking, Stocks & Insurance.","For post-graduation, DDUKK offers M.Voc courses in software and banking-related fields.",,
,any certification courses in Deen Dayal Upadhyay Kaushal Kendra (DDUKK)?,"DDUKK offers add-on certificate courses in e-Accounting & Tally, Multimedia & Animation, and Computers.",Students can enroll in add-on certificate courses alongside their main program to enhance practical skills.,"The Kendra provides value-added certificate courses in e-Accounting & Tally, Multimedia & Animation, and Computers.","Yes—there are extra certificate courses like animation, tally, and computers.",,
,how is admission done at DDUKK?,Admission to DDUKK programs is conducted through an entrance test due to high demand and limited sanctioned seats.,Students must apply through the prescribed entrance examination process and qualify to secure admission at DDUKK.,"Admissions at DDUKK are strictly entrance-based, as per institutional and university norms.",You’ll need to clear an entrance test to get into DDUKK—admissions aren’t direct.,,
,is DDUKK compliant with NSQF and UGC guidelines?,DDUKK is NSQF-compliant and operates under UGC-approved schemes.,Students enrolling at DDUKK benefit from NSQF-aligned programs that follow UGC regulations.,All programs at DDUKK are structured in compliance with NSQF standards and approved by the UGC Advisory Board.,"Yes, the courses here follow NSQF levels and are approved by UGC.",,
,does DDUKK provide industry exposure?,"Industry interaction at DDUKK includes guest lectures, industrial visits, internships, and industry-led training.","Students gain exposure through internships, live projects, industrial visits, and sessions conducted by industry professionals.","DDUKK integrates industry participation through structured internships, guest lectures, and practical training modules.","You’ll get industry exposure through internships, visits, and expert sessions.",,
,are internships provided to students?,"Students at DDUKK undertake internships with organizations in IT, banking, finance, and related sectors.",Internship opportunities are provided to help students gain real-world industry experience during their course.,Internship and industry training form an integral part of the DDUKK curriculum.,"Yes, internships are part of the program and tied to real companies.",,
,what labs and facilities are available at Deen Dayal Upadhyay Kaushal Kendra (DDUKK)?,"Deen Dayal Upadhyay Kaushal Kendra has an infrastructure spread over approximately 12,000 square feet. The facilities include two computer labs, one language lab, three smart classrooms, two presentation rooms, one conference hall, faculty rooms, a departmental store, and a kitchen. The centre is equipped with digital infrastructure such as smart boards, projectors, computers, microphones, and speakers.","Students at DDUKK have access to multiple learning facilities. The centre provides computer labs for practical work, a language lab for communication skills, smart classrooms for interactive learning, and presentation rooms for skill development. Digital tools like computers, projectors, and smart boards are available to support hands-on training.","The Deen Dayal Upadhyay Kaushal Kendra is equipped with modern academic and digital infrastructure spread across 12,000 square feet. The facilities include computer laboratories, a language laboratory, smart classrooms, presentation rooms, conference hall, faculty rooms, and supporting infrastructure. The centre is well-supported with digital teaching aids and computing resources to facilitate skill-based education.","DDUKK has well-equipped computer labs, a language lab, smart classrooms, and presentation rooms. There are plenty of computers, smart boards, and projectors to support practical and skill-based learning.",,
,,,,,,,
