id,Question,Informational,Guidance oriented,Institutional,Conversational,,
70,are there any students clubs?,"NCC (National Cadet Corps) – A voluntary service-oriented cadet program providing discipline, military training, and opportunities to participate in camps and events.
NSS (National Service Scheme) – A social service unit focusing on community engagement, outreach activities, cleanliness drives, health awareness, environmental programs, and more.
Rovers & Rangers Club (Scouts & Guides) – A club promoting service, discipline, leadership, and various outdoor and community activities.
C.B. Gupta Literary & Cultural Club – A club dedicated to promoting literary and cultural interests among students.
Sports & Games Club – Organises sports events, competitions, and physical-education-related activities.
The college also has committees such as the Students’ Welfare Committee, Committee for Cultural Activities, Library Committee, and Magazine Committee, where students can take active roles and contribute to campus life.","Students can get involved in several clubs and committees at the college:
NCC (National Cadet Corps) – Join for discipline, military training, and participation in camps and events.
NSS (National Service Scheme) – Engage in community service, cleanliness drives, health awareness, and environmental programs.
Rovers & Rangers Club – Develop leadership and discipline while participating in outdoor and community activities.
C.B. Gupta Literary & Cultural Club – Explore literary and cultural interests.
Sports & Games Club – Take part in sports events, competitions, and physical education activities.
Students can also actively contribute through committees such as the Students’ Welfare Committee, Committee for Cultural Activities, Library Committee, and Magazine Committee.","The college offers multiple clubs and committees for student participation:
NCC (National Cadet Corps) – A voluntary, service-oriented cadet program providing discipline, military training, and opportunities for participation in camps and events.
NSS (National Service Scheme) – A social service unit focusing on community engagement, outreach, cleanliness drives, health awareness, environmental programs, and related activities.
Rovers & Rangers Club (Scouts & Guides) – A club promoting service, discipline, leadership, and outdoor and community activities.
C.B. Gupta Literary & Cultural Club – A club dedicated to fostering literary and cultural interests among students.
Sports & Games Club – Organises sports events, competitions, and physical education activities.
In addition, the college maintains committees such as the Students’ Welfare Committee, Committee for Cultural Activities, Library Committee, and Magazine Committee, providing avenues for active student participation in campus life.","There are plenty of clubs and committees you can join at college:
NCC (National Cadet Corps) – Great for learning discipline, military training, and joining camps and events.
NSS (National Service Scheme) – Get involved in community service, cleanliness drives, health programs, and environmental activities.
Rovers & Rangers Club – Build leadership skills and have fun with outdoor and community activities.
C.B. Gupta Literary & Cultural Club – Perfect for students who love literature and culture.
Sports & Games Club – Take part in sports events, competitions, and physical activities.
Plus, you can actively contribute through committees like the Students’ Welfare Committee, Committee for Cultural Activities, Library Committee, and Magazine Committee, helping make campus life more vibrant.",,
,,,,,,,
,,,,,,,
,Who is the principal of the college?',Dr. Devendra Kumar Singh is the principal of National PG College.,Dr. Devendra Kumar Singh is the principal of National PG College.,Dr. Devendra Kumar Singh is the principal of National PG College.,Dr. Devendra Kumar Singh is the principal of National PG College.,,
115,whom to contact in case of harassment or ragging?,"The college website of National Post Graduate College provides an Anti-Ragging Portal and a Student Grievance Form for submitting such complaints. Students may also contact the college’s designated authorities, including the Anti-Ragging Squad or Committee, or any faculty member, as per UGC regulations.","Students facing issues related to ragging or grievances should first use the Anti-Ragging Portal or Student Grievance Form available on the college website. Additionally, they may approach the designated authorities as per UGC regulations, such as the Anti-Ragging Squad or Committee, or contact any faculty member for support.","Students are hereby informed that the college website of National Post Graduate College hosts an Anti-Ragging Portal and a Student Grievance Form for lodging complaints. Further, students may contact the designated authorities in accordance with UGC regulations, including the Anti-Ragging Squad or Committee, or any faculty member.","If you’re dealing with ragging or have a serious complaint, start with the Anti-Ragging Portal or Student Grievance Form on the college website. You can also directly reach out to the Anti-Ragging Squad, Committee members, or any faculty member—UGC rules back you on this.",,
117,what is the Grievance Redressal Committee?,"The Student Grievance Redressal Committee (SGRC) of National Post Graduate College (NPGC) is an official body established to address student complaints related to academic, administrative, or personal matters. It follows a fair, confidential, and transparent process for grievance resolution.","The Student Grievance Redressal Committee (SGRC) at National Post Graduate College (NPGC) is responsible for handling student complaints concerning academic, administrative, or personal issues. Students can approach the SGRC to ensure their concerns are addressed through a fair, confidential, and transparent process.","The Student Grievance Redressal Committee (SGRC) of National Post Graduate College (NPGC) is a statutory body constituted to address grievances of students pertaining to academic, administrative, and personal matters. The committee ensures a fair, confidential, and transparent mechanism for grievance redressal within the institution.","The SGRC at National Post Graduate College (NPGC) exists to handle student complaints—academic, administrative, or personal. It’s meant to resolve issues fairly, confidentially, and without unnecessary drama.",,
,tell me about National Post Graduate College?,"National PG College was established in 1974 by the then Chief Minister of Uttar Pradesh, Chandra Bhanu Gupta. It holds Autonomous status and has been awarded the College with Potential for Excellence (CPE). The college offers undergraduate and postgraduate programs in Arts and Commerce, undergraduate programs in Science and Computer faculties, and skill-based undergraduate and postgraduate programs under Deen Dayal Upadhyay Kaushal Kendra, supported by the University Grants Commission. The institution is equipped with modern academic facilities including laboratories, a computerized library, e-library, data analysis centre, and air-conditioned reading rooms.","Students seeking quality higher education can consider National Post Graduate College, established in 1974. The college offers a wide range of undergraduate and postgraduate programs across Arts, Commerce, Science, and Computer faculties. For skill-based education, students may enroll in vocational programs run under Deen Dayal Upadhyay Kaushal Kendra, supported by UGC. The campus provides well-equipped labs, library facilities, and dedicated reading spaces to support academic learning.","National Post Graduate College, established in 1974, is an Autonomous institution and a College with Potential for Excellence (CPE). The college offers undergraduate and postgraduate programs in Arts and Commerce, undergraduate programs in Science and Computer faculties, and skill development programs at undergraduate and postgraduate levels under Deen Dayal Upadhyay Kaushal Kendra with special grants from the University Grants Commission. The institution is committed to providing quality education supported by advanced academic infrastructure and facilities.","National P.G. College was started in 1974 and is one of the few colleges with Autonomous and CPE status. It offers UG and PG courses in Arts and Commerce, UG courses in Science and Computers, and skill-based programs through DDUKK. The campus has good labs, a rich library, e-library, and comfortable reading spaces.",,
,what is the vision of National Post Graduate College (NPGC)?,"The vision of National Post Graduate College is rooted in its motto “merit with ethics,” aiming to integrate merit and ethical values in academic programs so that students are transformed into dedicated, sincere, and responsible citizens who excel academically and uphold strong ethical principles.",National Post Graduate College’s vision focuses on blending academic merit with ethics. Students are encouraged to engage actively in learning and internalize ethical values so they develop both competence and character as responsible citizens.,"The vision of National Post Graduate College emphasizes the integration of ethical values with academic merit. The institution is committed to designing dynamic and innovative learning methodologies that enhance students’ academic accomplishments and instill a deep sense of ethics, transforming them into ideal, dedicated, and responsible citizens of society and the world.","NPGC’s vision is all about merit with ethics. In simple terms, it wants students not just to be smart, but also to be honest, responsible, and good citizens while they learn and grow.",,
,what is the mission of National Post Graduate College?,"The mission of National Post Graduate College is to provide quality education with the objective of developing disciplined, dedicated, and responsible citizens by nurturing academic excellence along with ethical and social values.","National Post Graduate College aims to deliver quality education that helps students grow academically while developing discipline, dedication, and a sense of responsibility. Students are encouraged to engage in learning that builds both knowledge and character.","The mission of National Post Graduate College is to impart quality education and foster holistic development by inculcating discipline, dedication, ethical values, and social responsibility among students, enabling them to contribute meaningfully to society.","NPGC’s mission is simple: give quality education and help students become disciplined, dedicated, and responsible individuals—not just degree holders.",,
,"who is the Manager of National Post Graduate College (NPGC), Lucknow?","The Manager of National Post Graduate College, Lucknow, is Ujjwal Raman Singh. He oversees the college administration along with the Principal.","For matters related to overall administration, the Manager of National PG College is Mr. Ujjwal Raman Singh. He works in coordination with the Principal to manage institutional administration.","Mr. Ujjwal Raman Singh serves as the Manager of National Post Graduate College, Lucknow, and is responsible for overseeing the administrative functioning of the institution in coordination with the Principal.",The Manager of NPGC is Mr. Ujjwal Raman Singh. He looks after the college administration along with the Principal.,,
,,,,,,,
58,how to apply for alumni cell?,"Students can join the alumni cell by contacting the head of the cell, Mr. Amit Srivastava (Assistant Professor, Computer Science Department).","Students interested in joining the alumni cell should reach out to Mr. Amit Srivastava, Assistant Professor in the Computer Science Department and head of the cell.","It is hereby informed that students may join the alumni cell by contacting Mr. Amit Srivastava, Assistant Professor of the Computer Science Department and head of the alumni cell.","If you’d like to join the alumni cell, just contact Mr. Amit Srivastava, Assistant Professor in the Computer Science Department and the head of the Acell.",,
59,what are the alumni events?,"The alumni meet is organized every year to foster connections between current and graduate students. The 2025 Alumni Meet, themed ""Naqsh-e-Awadh: The Legacy Trail,"" included a heritage walk.","Students and alumni are encouraged to participate in the annual alumni meet, which strengthens connections between current and graduate students. The 2025 edition, themed ""Naqsh-e-Awadh: The Legacy Trail,"" featured a heritage walk.","It is hereby informed that the alumni meet is held annually to promote interaction between current and graduate students. The 2025 Alumni Meet, conducted under the theme ""Naqsh-e-Awadh: The Legacy Trail,"" incorporated a heritage walk.","Every year, the alumni meet brings current and graduate students together. The 2025 meet, themed ""Naqsh-e-Awadh: The Legacy Trail,"" even had a heritage walk!",,
60,what is alumni cell ?,"The Alumni Cell of National Post Graduate College (NPGC), Lucknow, maintains connections between the college and its alumni through networking, events, and mentorship. The cell serves as a bridge between alumni, current students, and the college administration.","Alumni are encouraged to engage with the NPGC Alumni Cell, which fosters lasting connections through networking, events, and mentorship. It connects former students, current students, and the college administration.","It is hereby informed that the Alumni Cell of National Post Graduate College (NPGC), Lucknow, facilitates enduring ties between the institution and its alumni through organized events, networking initiatives, and mentorship programs. It functions as a liaison among alumni, current students, and the college administration.","The NPGC Alumni Cell keeps alumni connected to the college through networking, events, and mentorship. The cell is a great way for former students, current students, and the college to stay in touch!",,
61,how to apply for placement cell?,"Applicants can contact the Placement and Training Cell at placement@npgc or through the phone number listed on the college website(https://www.npgc.in/StudentSupport-Placements.aspx) to inquire about joining placement cells. Students may also contact the head of the cell, Dr. Shalini Lamba (HOD of Computer Science) or Mr. Abhinav Dwivedi (Training and Placement Officer).","To learn how to join or participate in placement cells, applicants can email the Placement and Training Cell at placement@npgc or call the phone number provided on the college website(https://www.npgc.in/StudentSupport-Placements.aspx). Students can also reach out to the head of the cell, Dr. Shalini Lamba (HOD of Computer Science) or Mr. Abhinav Dwivedi (Training and Placement Officer).","Applicants seeking information on joining or participating in placement cells may contact the Placement and Training Cell via email at placement@npgc or through the contact number available on the college website(https://www.npgc.in/StudentSupport-Placements.aspx). Additionally, students may approach the head of the cell, Dr. Shalini Lamba, Head of the Department of Computer Science or Mr. Abhinav Dwivedi (Training and Placement Officer).","If you want to know how to join or take part in placement cells, you can email the Placement and Training Cell at placement@npgc or call the number listed on the college website(https://www.npgc.in/StudentSupport-Placements.aspx). You can also reach out to the cell head, Dr. Shalini Lamba, HOD of Computer Science or Mr. Abhinav Dwivedi (Training and Placement Officer).",,
91,who is the Placement incharge?,Dr. Gyanendra Kumar is the Placement-incharge.,Students should note that Dr. Gyanendra Kumar serves as the Placement incharge.,Dr. Gyanendra Kumar holds the position of Placement incharge.,Dr. Gyanendra Kumar is the Placement incharge.,,
94,where to get information about internships or placements?,Information regarding internships or placements can be obtained from the department head or the placement cell head. You may also contact any member of the placement team. Updates are available on placementcell.npgc (Instagram page) and PLACEMENT CELL NPGC (WhatsApp channel).,"To get information about internships or placements, you can contact the department head or the placement cell head. You may also reach out to any member of the placement team. Additionally, follow placementcell.npgc on Instagram or PLACEMENT CELL NPGC on the WhatsApp channel for updates.",Information related to internships or placements may be obtained from the department head or the placement cell head. Students may also approach any member of the placement team. Updates regarding internships and placements are shared through placementcell.npgc (Instagram) and PLACEMENT CELL NPGC (WhatsApp channel).,"For internship or placement information, you can talk to the department head or the placement cell head. You can also connect with any member of the placement team. For updates, follow placementcell.npgc on Instagram or the PLACEMENT CELL NPGC WhatsApp channel.",,
,,,,,,,
57,what documents are required for hostel admission?,"To gain admission to the hostel, students are required to submit their 10th and 12th marksheets along with recently taken passport-size photographs.",Students seeking hostel admission must submit copies of their 10th and 12th marksheets along with recent passport-size photographs as part of the admission process.,Students applying for hostel admission are required to submit their 10th and 12th marksheets along with recent passport-size photographs for verification purposes.,"If you want hostel admission, keep your 10th and 12th marksheets ready and bring a few recent passport-size photos. No documents, no admission.",,
,What kind of rooms are provided in hostel?,"The hostel offers two types of rooms: AC and Non-AC.
• The annual fee for an AC room is ?90,000 + ?2,000, payable in two installments.
• The annual fee for a Non-AC room is ?75,000 + ?2,000, payable in two installments.
• In both cases, ?5,000 are charged as caution money.
• Each hostel room accommodates three students and is equipped with three beds and cupboards.","Students can choose between AC and Non-AC hostel rooms.
• AC rooms cost ?90,000 + ?2,000 per year, payable in two installments, along with ?5,000 as caution money.
• Non-AC rooms cost ?75,000 + ?2,000 per year, payable in two installments, along with ?5,000 as caution money.
Each room is shared by three students and includes beds and cupboards for storage.","The hostel provides AC and Non-AC accommodation. The annual fee for AC rooms is ?90,000+ ?2,000 and for Non-AC rooms is ?75,000 + ?2,000, both payable in two installments. A caution money of ?5,000 is applicable in each case. Hostel rooms are triple-sharing and are furnished with beds and cupboards.","The hostel has AC and Non-AC rooms.
AC rooms cost ?90,000 + ?2,000 a year and Non-AC rooms cost ?75,000 + ?2,000, both paid in two installments. You’ll also need to pay ?5,000 as caution money. Each room is shared by three students and comes with beds and cupboards.",,
,are there different hostels for boys and girls?,"Yes, boys and girls are allotted separate hostels at National Post Graduate College.",Students should note that hostel accommodation is allotted separately for boys and girls. Applicants will be assigned to the respective hostel based on gender during the hostel allocation process.,"The institution provides separate hostel accommodation for boys and girls. Hostel allotment is done accordingly, as per college rules.","Yes, boys and girls stay in different hostels. Accommodation is separate.",,
,,,,,,,
10,how to apply for college leave officially?,"Students may submit a written application to the Head of Department, send it through a friend, or email it to the department’s email ID.","You can submit your application by writing to the Head of Department, sending it through one of your friends, or emailing it to the department’s official email ID.","Students are permitted to submit a written application addressed to the Head of Department either in person, through a representative, or via the department’s official email ID.","You can apply by submitting a written application to the HOD, sending it through a friend, or emailing it to the department’s email ID.",,
19,what documents are required for college admission?,"Applicants are required to attach self-attested copies of the following documents with their application: Pass Certificate and Marksheet of Class X (10th), Pass Certificate and Marksheet of Class XII (12th), Marksheet of the last examination passed, proof of not taking admission elsewhere along with a notarized declaration of no legal issues (if the qualifying examination was passed in the specified earlier years), Character Certificate from the Head of the last institution attended (original to be submitted at the time of counseling), Character Certificate from the Superintendent of Police, District Magistrate, or Gazetted Officer for private candidates (certified after the specified date), and an attested copy of the Caste Certificate or CMO Certificate for reserved category applicants (original to be produced during counseling). For more information on admission procedure, visit https://www.npgc.in/Admission-Procedures.aspx","While submitting the application, applicants should ensure that self-attested copies of all required documents are attached. These include Class X and Class XII pass certificates and marksheets, the marksheet of the last examination passed, and, where applicable, proof of not taking admission elsewhere along with a notarized declaration regarding no legal issues. A Character Certificate from the Head of the last institution attended is required, with the original to be submitted during counseling. Private candidates must provide a Character Certificate issued by the Superintendent of Police, District Magistrate, or a Gazetted Officer after the specified date. Applicants applying under a reserved category must also attach an attested copy of the relevant Caste or CMO Certificate, with the original to be shown at counseling. For more information on admission procedure, visit https://www.npgc.in/Admission-Procedures.aspx","All applicants must submit self-attested copies of the prescribed documents along with their application. These documents include the Pass Certificate and Marksheet of Class X (10th), Pass Certificate and Marksheet of Class XII (12th), and the Marksheet of the last examination passed. Candidates who passed the qualifying examination in the specified earlier years must additionally submit proof of not having taken admission elsewhere along with a notarized declaration stating that there are no legal issues. A Character Certificate issued by the Head of the last institution attended is mandatory, with the original to be produced at the time of counseling. Private candidates are required to submit a Character Certificate issued by the Superintendent of Police, District Magistrate, or a Gazetted Officer, certified after the specified date. Reserved category candidates must submit an attested copy of the applicable Caste Certificate or CMO Certificate, with the original to be verified during counseling. For more information on admission procedure, visit https://www.npgc.in/Admission-Procedures.aspx","When applying, make sure to attach self-attested copies of all required documents. This includes your Class 10 and Class 12 pass certificates and marksheets, as well as the marksheet of the last exam you passed. If you completed your qualifying exam in the specified earlier years, you’ll also need to submit proof that you didn’t take admission elsewhere along with a notarized declaration stating there are no legal issues. A Character Certificate from the Head of your last institution is required, and you’ll need to submit the original during counseling. Private candidates must provide a Character Certificate issued by the Superintendent of Police, District Magistrate, or a Gazetted Officer after the specified date. If you are applying under a reserved category, don’t forget to attach an attested copy of your Caste or CMO Certificate and bring the original for counseling. For more information on admission procedure, visit https://www.npgc.in/Admission-Procedures.aspx",,
22,how can I get my personal details updated in college database?,Student information can be updated by submitting a request to the Head of the Department.,"If any student information needs to be updated, the student should raise a formal request with the Head of the Department for verification and approval.",Requests for updating student information must be formally submitted to the Head of the Department for necessary review and authorization.,Need to update your details? Don’t play detective—just raise a request with the Head of the Department and get it done properly.,,
